{
  "schema": "gatebox.catalog/v1",
  "extensionApi": 1,
  "generatedAt": "2026-09-16T03:38:05Z",
  "publisher": {
    "id": "jiangbeta",
    "name": "GateBox"
  },
  "plugins": [
    {
      "id": "caddy-l4",
      "versions": [
        {
          "version": "0.1.0",
          "channel": "official",
          "publishedAt": "2026-09-16T03:38:05Z",
          "extensionApi": 1,
          "manifest": {
            "apiVersion": "gatebox/v2",
            "channel": "official",
            "contributions": {
              "backend": [
                {
                  "for": "non-http",
                  "impl": {
                    "template": "layer4 {\n{{- range .Rules }}\n{{- $r := . }}\n{{- range $r.Nets }}\n{{- $net := . }}\n{{- range $r.Ports }}\n\t{{ $net }}/:{{ . }} {\n\t\troute {\n\t\t\tproxy {{ $net }}/{{ $r.Upstream }}\n\t\t}\n\t}\n{{- end }}\n{{- end }}\n{{- end }}\n}",
                    "type": "template"
                  },
                  "point": "renderer",
                  "scope": "global"
                }
              ],
              "capabilities": [
                {
                  "data": {
                    "component": "caddy",
                    "feature": "github.com/mholt/caddy-l4"
                  },
                  "point": "component-variant"
                },
                {
                  "data": {
                    "class": "non-http",
                    "label": "TCP/UDP",
                    "networks": [
                      "tcp",
                      "udp"
                    ],
                    "requiresPrimaryDomain": false
                  },
                  "point": "proxy-protocols"
                }
              ],
              "ui": {
                "page": {
                  "type": "settings"
                },
                "slots": [
                  {
                    "from": "proxy-protocols",
                    "slot": "port-form.protocol-options"
                  }
                ]
              }
            },
            "id": "caddy-l4",
            "kind": "caddy-module",
            "name": "Caddy L4",
            "permissions": [
              {
                "api": [
                  "gateway:read"
                ]
              }
            ],
            "publisher": {
              "id": "jiangbeta",
              "name": "GateBox"
            },
            "requires": {
              "components": [
                "caddy"
              ],
              "extensionApi": "\u003e=1",
              "gatebox": "\u003e=0.4.0"
            },
            "summary": "为 Caddy 增加 TCP/UDP（L4）代理能力",
            "tags": [
              "Caddy插件",
              "TCP/UDP"
            ],
            "version": "0.1.0"
          }
        }
      ]
    },
    {
      "id": "coraza",
      "versions": [
        {
          "version": "0.1.0",
          "channel": "official",
          "publishedAt": "2026-09-16T03:38:05Z",
          "extensionApi": 1,
          "manifest": {
            "apiVersion": "gatebox/v2",
            "channel": "official",
            "contributions": {
              "capabilities": [
                {
                  "data": {
                    "component": "caddy",
                    "feature": "github.com/corazawaf/coraza-caddy/v2"
                  },
                  "point": "component-variant"
                }
              ],
              "ui": {
                "nav": [
                  {
                    "icon": "shield",
                    "label": "WAF",
                    "path": "/plugins/coraza"
                  }
                ],
                "page": {
                  "type": "settings"
                }
              }
            },
            "id": "coraza",
            "kind": "caddy-module",
            "name": "Coraza WAF",
            "permissions": [
              {
                "api": [
                  "gateway:read"
                ]
              }
            ],
            "publisher": {
              "id": "jiangbeta",
              "name": "GateBox"
            },
            "requires": {
              "components": [
                "caddy"
              ],
              "extensionApi": "\u003e=1",
              "gatebox": "\u003e=0.4.0"
            },
            "summary": "OWASP CRS 规则的 Web 应用防火墙（需含 coraza 模块的 Caddy 制品）",
            "tags": [
              "Caddy插件"
            ],
            "version": "0.1.0"
          }
        }
      ]
    },
    {
      "id": "geoip",
      "versions": [
        {
          "version": "0.1.0",
          "channel": "official",
          "publishedAt": "2026-09-16T03:38:05Z",
          "extensionApi": 1,
          "manifest": {
            "apiVersion": "gatebox/v2",
            "channel": "official",
            "contributions": {
              "capabilities": [
                {
                  "data": {
                    "component": "caddy",
                    "feature": "github.com/porech/caddy-maxmind-geolocation"
                  },
                  "point": "component-variant"
                }
              ],
              "ui": {
                "page": {
                  "type": "settings"
                }
              }
            },
            "id": "geoip",
            "kind": "caddy-module",
            "name": "GeoIP",
            "permissions": [
              {
                "api": [
                  "gateway:read"
                ]
              }
            ],
            "publisher": {
              "id": "jiangbeta",
              "name": "GateBox"
            },
            "requires": {
              "components": [
                "caddy"
              ],
              "extensionApi": "\u003e=1",
              "gatebox": "\u003e=0.4.0"
            },
            "summary": "按国家/地区做访问控制与分流（需含 geoip 模块的 Caddy 制品）",
            "tags": [
              "Caddy插件"
            ],
            "version": "0.1.0"
          }
        }
      ]
    },
    {
      "id": "mosdns",
      "versions": [
        {
          "version": "0.1.0",
          "channel": "official",
          "publishedAt": "2026-09-16T03:38:05Z",
          "extensionApi": 1,
          "manifest": {
            "apiVersion": "gatebox/v2",
            "artifacts": [
              {
                "arch": "amd64",
                "os": "linux",
                "role": "binary",
                "sha256": "",
                "url": "https://github.com/IrineSistiana/mosdns/releases/download/v5.3.3/mosdns-linux-amd64.zip"
              },
              {
                "arch": "amd64",
                "os": "linux",
                "role": "sidecar",
                "sha256": "",
                "url": "https://github.com/JiangBeta/GateBoxStore/releases/download/mosdns/v0.1.0/mosdns-sidecar-linux-amd64.tar.gz"
              },
              {
                "format": "iframe",
                "role": "ui",
                "sha256": "",
                "url": "https://github.com/JiangBeta/GateBoxStore/releases/download/mosdns/v0.1.0/mosdns-ui.tar.gz"
              }
            ],
            "channel": "official",
            "contributions": {
              "ui": {
                "nav": [
                  {
                    "label": "MosDNS",
                    "path": "/plugins/mosdns"
                  }
                ]
              }
            },
            "id": "mosdns",
            "kind": "process",
            "name": "MosDNS",
            "permissions": [
              {
                "filesystem": {
                  "write": [
                    "tools/mosdns"
                  ]
                }
              },
              {
                "api": [
                  "domain:read"
                ]
              }
            ],
            "publisher": {
              "id": "jiangbeta",
              "name": "GateBox"
            },
            "requires": {
              "extensionApi": "\u003e=1",
              "gatebox": "\u003e=0.4.0",
              "os": [
                "linux"
              ]
            },
            "summary": "内网 DNS 解析与分流（独立后端 + 独立管理页）",
            "tags": [
              "独立进程",
              "DNS"
            ],
            "version": "0.1.0"
          },
          "artifacts": [
            {
              "arch": "amd64",
              "os": "linux",
              "role": "binary",
              "sha256": "",
              "url": "https://github.com/IrineSistiana/mosdns/releases/download/v5.3.3/mosdns-linux-amd64.zip"
            },
            {
              "arch": "amd64",
              "os": "linux",
              "role": "sidecar",
              "sha256": "",
              "url": "https://github.com/JiangBeta/GateBoxStore/releases/download/mosdns/v0.1.0/mosdns-sidecar-linux-amd64.tar.gz"
            },
            {
              "format": "iframe",
              "role": "ui",
              "sha256": "",
              "url": "https://github.com/JiangBeta/GateBoxStore/releases/download/mosdns/v0.1.0/mosdns-ui.tar.gz"
            }
          ]
        }
      ]
    },
    {
      "id": "realip",
      "versions": [
        {
          "version": "0.1.0",
          "channel": "official",
          "publishedAt": "2026-09-16T03:38:05Z",
          "extensionApi": 1,
          "manifest": {
            "apiVersion": "gatebox/v2",
            "channel": "official",
            "contributions": {
              "ui": {
                "page": {
                  "type": "settings"
                }
              }
            },
            "id": "realip",
            "kind": "config-only",
            "name": "Real IP",
            "permissions": [
              {
                "api": [
                  "gateway:read"
                ]
              }
            ],
            "publisher": {
              "id": "jiangbeta",
              "name": "GateBox"
            },
            "requires": {